{"cpts":[{"node":"Age","parents":[],"state_names":{"Age":["18-21","22-25","26-29","30-34","35-40","41-45","46-50","More than 50"]},"values":[[0.7041420118343196],[0.11834319526627218],[0.01775147928994083],[0.01775147928994083],[0.04142011834319527],[0.023668639053254437],[0.023668639053254437],[0.05325443786982249]]},{"node":"Gender","parents":[],"state_names":{"Gender":["Female","Male","Prefiero no dec"]},"values":[[0.8106508875739645],[0.1834319526627219],[0.005917159763313609]]},{"node":"Q1_Traditional_Mexican","parents":["Q5_Authenticity_Elaboration"],"state_names":{"Q1_Traditional_Mexican":["No","Yes"],"Q5_Authenticity_Elaboration":["No","Yes"]},"values":[[0.5428571428571428,0.14925373134328357],[0.45714285714285713,0.8507462686567164]]},{"node":"Q2_Purchase_Intention","parents":[],"state_names":{"Q2_Purchase_Intention":["No","Yes"]},"values":[[0.40236686390532544],[0.5976331360946746]]},{"node":"Q3_Recommendation","parents":["Q2_Purchase_Intention"],"state_names":{"Q2_Purchase_Intention":["No","Yes"],"Q3_Recommendation":["No","Yes"]},"values":[[0.6764705882352942,0.04950495049504951],[0.3235294117647059,0.9504950495049505]]},{"node":"Q4_Gastronomic_Heritage","parents":["Q1_Traditional_Mexican","Q3_Recommendation"],"state_names":{"Q1_Traditional_Mexican":["No","Yes"],"Q3_Recommendation":["No","Yes"],"Q4_Gastronomic_Heritage":["No","Yes"]},"values":[[0.95,0.8421052631578947,0.5806451612903226,0.21212121212121213],[0.05,0.15789473684210525,0.41935483870967744,0.7878787878787878]]},{"node":"Q5_Authenticity_Elaboration","parents":["Q3_Recommendation"],"state_names":{"Q3_Recommendation":["No","Yes"],"Q5_Authenticity_Elaboration":["No","Yes"]},"values":[[0.49019607843137253,0.0847457627118644],[0.5098039215686274,0.9152542372881356]]},{"node":"Q6_Commercial_Potential","parents":["Q3_Recommendation"],"state_names":{"Q3_Recommendation":["No","Yes"],"Q6_Commercial_Potential":["No","Yes"]},"values":[[0.5098039215686274,0.059322033898305086],[0.49019607843137253,0.940677966101695]]},{"node":"Q7_Culture_Preservation","parents":["Q5_Authenticity_Elaboration"],"state_names":{"Q5_Authenticity_Elaboration":["No","Yes"],"Q7_Culture_Preservation":["No","Yes"]},"values":[[0.17142857142857143,0.03731343283582089],[0.8285714285714286,0.9626865671641791]]},{"node":"Q8_Sensory_Uniqueness","parents":[],"state_names":{"Q8_Sensory_Uniqueness":["No","Yes"]},"values":[[0.25443786982248523],[0.7455621301775148]]},{"node":"Standardized_City","parents":[],"state_names":{"Standardized_City":["Guadalajara","Jalisco (Otro)","No especificado","Otro","Zapopan"]},"values":[[0.6153846153846154],[0.011834319526627219],[0.07100591715976332],[0.023668639053254437],[0.2781065088757396]]}],"edges":[{"source":"Q1_Traditional_Mexican","target":"Q4_Gastronomic_Heritage"},{"source":"Q2_Purchase_Intention","target":"Q3_Recommendation"},{"source":"Q3_Recommendation","target":"Q4_Gastronomic_Heritage"},{"source":"Q3_Recommendation","target":"Q5_Authenticity_Elaboration"},{"source":"Q3_Recommendation","target":"Q6_Commercial_Potential"},{"source":"Q5_Authenticity_Elaboration","target":"Q1_Traditional_Mexican"},{"source":"Q5_Authenticity_Elaboration","target":"Q7_Culture_Preservation"}],"format":"proyecto-tenate-bayesian-model","metadata":{"learning":{"algorithm":"Hill-Climbing","bic":-1120.745640251432,"dag_sha256":"11fb5b49d2d51e4508563e4ba4b1d07eba1e36cf0e6da36703312c9c08136cdb","score":"bic-d","tie_breaking":"canonical operation order","tie_events":1},"parameters":{"cpt_sha256":"a35320e2de8b2bc7c3af0093b968b1b46d28f8a8911a8ebbc19710861a88e61c","estimator":"MaximumLikelihoodEstimator","weighted":false},"scientific_status":"Reproducible reconstruction derived from the audited CSV; not an exact recovery of the published original model.","software":{"networkx":"3.6.1","numpy":"2.5.2","pandas":"3.0.5","pgmpy":"1.1.2","python":"3.12.13"},"source":{"excluded_columns":["Judge_ID"],"original_columns":12,"records":169,"sha256":"2a74e34d0cb9dad5f98bdd8d0cf4691c5ffc929ead195ea39de603974ca716be"},"training":{"records":169,"sha256":"c8eb4a4e2107fde5817f87481db1a59485cf82e1ec41e9d42a672b578bb033e5","variables":11}},"model_version":"1.0.0","nodes":[{"id":"Age","states":["18-21","22-25","26-29","30-34","35-40","41-45","46-50","More than 50"]},{"id":"Gender","states":["Female","Male","Prefiero no dec"]},{"id":"Q1_Traditional_Mexican","states":["No","Yes"]},{"id":"Q2_Purchase_Intention","states":["No","Yes"]},{"id":"Q3_Recommendation","states":["No","Yes"]},{"id":"Q4_Gastronomic_Heritage","states":["No","Yes"]},{"id":"Q5_Authenticity_Elaboration","states":["No","Yes"]},{"id":"Q6_Commercial_Potential","states":["No","Yes"]},{"id":"Q7_Culture_Preservation","states":["No","Yes"]},{"id":"Q8_Sensory_Uniqueness","states":["No","Yes"]},{"id":"Standardized_City","states":["Guadalajara","Jalisco (Otro)","No especificado","Otro","Zapopan"]}],"schema_version":1}